"ВАКУУМНАЯ ПОМПА SEX EXPERT M 20 х 5,5 см",2 990р.,Нет,Нет,https://nestidno.ru/vakuumnaya-pompa-sex-expert-m-20-h-5-5-sm-sem-55166,https://nestidno.ru/image/cache/catalog/i/ce/kp/929cd2677e91ff12f17e9c49c31cba0c-500x500.jpg
Набор вакуумная помпа и зажим для клитора Luxe Fetish Deluxe Pussy Pump with Quick Release Valves and Clit Clamp,6 900р.,Нет,Нет,https://nestidno.ru/nabor-vakuumnaya-pompa-i-zagim-dlya-klitora-luxe-fetish-deluxe-pussy-pump-with-quick-release-valves-and-clit-clamp,https://nestidno.ru/image/cache/catalog/LF5212-500x500.jpg
Помпа женская Vagina Sucker,3 990р.,Нет,Нет,https://nestidno.ru/pompa-genskaya-vagina-sucker-5206750000,https://nestidno.ru/image/cache/catalog/i/pk/ko/77014ed5ca0261909dc9fc80df06f2db-500x500.jpg
Вагинальная помпа с вибрацией Vibrating Pussy Pump,6 900р.,Нет,Нет,https://nestidno.ru/vaginalnaya-pompa-s-vibratsiej-vibrating-pussy-pump,https://nestidno.ru/image/cache/catalog/PD3692-20-500x500.jpg
Вакуумная вибропомпа для половых губ Vibrating Vagina Sucker,5 990р.,Нет,Нет,https://nestidno.ru/vakuumnaya-vibropompa-dlya-polovyh-gub-vibrating-vagina-sucker,https://nestidno.ru/image/cache/catalog/5987390000_23-500x500.jpg
"ВАКУУМНАЯ ПОМПА SEX EXPERT M 20 х 5,5 см SEM-55163",2 990р.,Нет,Нет,https://nestidno.ru/vakuumnaya-pompa-sex-expert-m-20-h-5-5-sm-sem-55163,https://nestidno.ru/image/cache/catalog/i/be/gi/00a6cd3b9b62b9edd749eb11aadaeab2-500x500.jpg
Набор вакуумных помп для пениса Optimum Series Maximum Results Pump Set,7 490р.,Нет,Нет,https://nestidno.ru/nabor-vakuumnyh-pomp-dlya-penisa-optimum-series-maximum-results-pump-set,https://nestidno.ru/image/cache/catalog/SE-1023-10-3_1-500x500.jpg
"ПОМПА ВАКУУМНАЯ С ВИБРАЦИЕЙ SEX EXPERT L 20 х 5,5 см SEM-55165",3 890р.,Нет,Нет,https://nestidno.ru/pompa-vakuumnaya-s-vibratsiej-sex-expert-l-28-h-6-5-sm-sem-55165,https://nestidno.ru/image/cache/catalog/i/he/ff/12df004cd244c0156b9f06fad280d17d-500x500.jpg
Вакуумная помпа для пениса Comfort Beginner Pump PMP002BLK,2 990р.,Нет,Нет,https://nestidno.ru/vakuumnaya-pompa-dlya-penisa-comfort-beginner-pump-pmp002blk,https://nestidno.ru/image/cache/catalog/PMP002BLK-500x500.jpg
Вакуумная помпа для пениса Deluxe Beginner Pump PMP003BLK,2 990р.,Нет,Нет,https://nestidno.ru/vakuumnaya-pompa-dlya-penisa-deluxe-beginner-pump-pmp003blk,https://nestidno.ru/image/cache/catalog/PMP003BLK-500x500.jpg
Гидропомпа HYDROMAX5 RED,8 900р.,Нет,Нет,https://nestidno.ru/gidropompa-hydromax5-red,https://nestidno.ru/image/cache/catalog/hydromax5red1-500x500.png
Вакуумная помпа-насос для головки Suck N’ Stroke Head Pump,2 990р.,Нет,Нет,https://nestidno.ru/vakuumnaya-pompa-nasos-dlya-golovki-suck-n%E2%80%99-stroke-head-pump,https://nestidno.ru/image/cache/catalog/PD2103-23-500x500.jpg
Гидропомпа HydroXTREME5 CLEAR,17 900р.,-22%,13 990р.,https://nestidno.ru/gidropompa-hydroxtreme5-clear,https://nestidno.ru/image/cache/catalog/BM-HX5-CC-500x500.jpg
ПОМПА ВАКУУМНАЯ С МАНОМЕТРОМ L 200 мм D 60 мм арт. SEM-55168,2 990р.,Нет,Нет,https://nestidno.ru/pompa-vakuumnaya-s-manometrom-l-200-mm-d-60-mm-art-sem-55168,https://nestidno.ru/image/cache/catalog/SEM-55168-500x500.jpg
Автоматическая помпа для пениса DISCOVERY Surfer,4 990р.,Нет,Нет,https://nestidno.ru/avtomaticheskaya-pompa-dlya-penisa-discovery-surfer,https://nestidno.ru/image/cache/catalog/6910-00Lola-500x500.jpg
"ВАКУУМНАЯ ПОМПА SEX EXPERT M 20 х 5,5 см",1 990р.,Нет,Нет,https://nestidno.ru/vakuumnaya-pompa-sex-expert-m-20-h-5-5-sm-sem-55161,https://nestidno.ru/image/cache/catalog/55161-500x500.jpg
Вакуумная помпа для клитора Vaginal Pump Erozon,3 250р.,Нет,Нет,https://nestidno.ru/vakuumnaya-pompa-dlya-klitora-vaginal-pump-erozon,https://nestidno.ru/image/cache/catalog/pw003-1-500x500.jpg
Вакуумная помпа для сосков Nipple Sucker Erozon,1 750р.,Нет,Нет,https://nestidno.ru/vakuumnaya-pompa-dlya-soskov-nipple-sucker-erozon,https://nestidno.ru/image/cache/catalog/PW005-1-500x500.jpg
Гидропомпа для увеличения пениса Bathmate HYDROMAX9 Blue,13 500р.,Нет,Нет,https://nestidno.ru/gidropompa-dlya-uvelicheniya-penisa-bathmate-hydromax-x40-blue,https://nestidno.ru/image/cache/catalog/BM-HM9-AB_-500x500.jpg
Гидропомпа HYDROMAX7 CRYSTAL CLEAR,9 900р.,Нет,Нет,https://nestidno.ru/gidropompa-hydromax7-crystal-clear,https://nestidno.ru/image/cache/catalog/wideboy771-500x500.png
