Вагина-мастурбатор KOKOS ELEGANCE.01 16 см M01-03-001,2 990р.,Нет,Нет,https://nestidno.ru/vagina-masturbator-kokos-elegance-01-16-sm-m01-03-001,https://nestidno.ru/image/cache/catalog/M01-03-001D-500x500.jpg
Мастурбатор для мужчин Tenga Flip Zero Black Strong Edition,13 900р.,Нет,Нет,https://nestidno.ru/masturbator-dlya-mugchin-tenga-flip-zero-black-strong-edition-tfz-002,https://nestidno.ru/image/cache/catalog/TFZ-002-500x500.jpg
Мастурбатор рот и вагина 2 in 1 Hummer,4 900р.,Нет,Нет,https://nestidno.ru/masturbator-rot-i-vagina-2-in-1-hummer,https://nestidno.ru/image/cache/catalog/i/mc/ao/1906964899ebe7d8c938155aba5d7d60-500x500.jpg
МАСТУРБАТОР-ТОРС С ВИБРАЦИЕЙ И РОТАЦИЕЙ KOKOS HERA HIP REAL 26 СМ,14 900р.,Нет,Нет,https://nestidno.ru/masturbator-s-vibratsiej-i-rotatsiej-kokos-hera-hip-real-26-sm,https://nestidno.ru/image/cache/catalog/M10-03-22V-500x500.jpg
Мега-мастурбатор торс вагина и анус Big baby 12 кг,29 000р.,-31%,19 900р.,https://nestidno.ru/mega-masturbator-vagina-i-anus-big-baby,https://nestidno.ru/image/cache/catalog/bigbaby-500x500.jpg
Реалистичный двойной мастурбатор Real Booty 24*21см,9 900р.,Нет,Нет,https://nestidno.ru/realistichnyj-dvojnoj-masturbator-real-booty-24-21sm,https://nestidno.ru/image/cache/catalog/RB001-500x500.jpg
Автоматический интерактивный мастурбатор Svakom Alex Neo,17 900р.,Нет,Нет,https://nestidno.ru/avtomaticheskij-interaktivnyj-masturbator-svakom-alex-neo,https://nestidno.ru/image/cache/catalog/S63D-500x500.jpg
Автоматический интерактивный мастурбатор Svakom Sam Neo,13 900р.,Нет,Нет,https://nestidno.ru/avtomaticheskij-interaktivnyj-masturbator-svakom-sam-neo,https://nestidno.ru/image/cache/catalog/S08A_4-500x500.jpg
АВТОМАТИЧЕСКИЙ МАСТУРБАТОР С ПОСТУПАТЕЛЬНЫМИ ДВИЖЕНИЯМИ OZZY,7 490р.,Нет,Нет,https://nestidno.ru/avtomaticheskij-masturbator-s-postupatelnymi-dvigeniyami-ozzy,https://nestidno.ru/image/cache/catalog/BM-00900T54S_2-500x500.jpg
Вагина Oxana Pussy And Ass ,6 900р.,Нет,Нет,https://nestidno.ru/vagina-oxana-pussy-and-ass,https://nestidno.ru/image/cache/catalog/5246380000-500x500.jpg
Вагина-мастурбатор KOKOS ELEGANCE 16 см m01-03-007,2 990р.,Нет,Нет,https://nestidno.ru/vagina-masturbator-kokos-elegance-16-sm-m01-03-007,https://nestidno.ru/image/cache/catalog/m01-03-007_5-500x500.jpg
ВАГИНА-МАСТУРБАТОР арт. SQ-50068,6 900р.,Нет,Нет,https://nestidno.ru/vagina-masturbator-s-vibratsiej-8-regimov-art-sq-50068,https://nestidno.ru/image/cache/catalog/sq-50068_111-500x500.jpg
Интерактивный мастурбатор Kiiroo Keon & Feel Stroker,24 900р.,Нет,Нет,https://nestidno.ru/interaktivnyj-masturbator-keon-by-kiiroo,https://nestidno.ru/image/cache/catalog/11032-500x500.jpeg
Интерактивный мастурбатор LOVENSE CALOR,15 900р.,Нет,Нет,https://nestidno.ru/interaktivnyj-masturbator-lovense-calor,https://nestidno.ru/image/cache/catalog/LE-16-500x500.jpg
Интерактивный мастурбатор LOVENSE MAX 2,15 900р.,Нет,Нет,https://nestidno.ru/interaktivnyj-masturbator-lovense-max-2,https://nestidno.ru/image/cache/catalog/LE-014_345-500x500.jpg
МАСТУРБАТОР c вибрацией EMILY BM-00900T65,4 250р.,Нет,Нет,https://nestidno.ru/masturbator-c-vibratsiej-emily-bm-00900t65,https://nestidno.ru/image/cache/catalog/BM-00900T65-500x500.jpg
Мастурбатор TENGA Air-Tech Twist Ripple,3 950р.,Нет,Нет,https://nestidno.ru/masturbator-tenga-air-tech-twist-ripple,https://nestidno.ru/image/cache/catalog/ATT-002-500x500.jpg
Мастурбатор TENGA SPINNER Hexa,3 900р.,Нет,Нет,https://nestidno.ru/masturbator-tenga-spinner-hexa-spn-002,https://nestidno.ru/image/cache/catalog/i/db/al/a2ea591db65382a6d99d10d8bb7491d9-500x500.jpg
Мастурбатор в пластиковом корпусе Eroman 25 см,2 990р.,Нет,Нет,https://nestidno.ru/vagina-eroman,https://nestidno.ru/image/cache/catalog/ee-10114-500x500.jpg
Мастурбатор с вибрацией и приложением LOVENSE GUSH,19 900р.,Нет,Нет,https://nestidno.ru/masturbator-s-vibratsiej-i-prilogeniem-lovense-gush,https://nestidno.ru/image/cache/catalog/LE-14_45245-500x500.jpg
Мастурбатор-вагина FLESHLIGHT SIGNATURE Mia Malkova,8 990р.,-23%,6 900р.,https://nestidno.ru/masturbator-vagina-fleshlight-signature-mia-malkova,https://nestidno.ru/image/cache/catalog/11611-500x500.jpeg
"Мастурбатор-полуторс Juliana с вибрацией, ротацией и голосом",11 900р.,Нет,Нет,https://nestidno.ru/masturbator-polutors-juliana-s-vibratsiej-rotatsiej-i-golosom,https://nestidno.ru/image/cache/catalog/i/bh/ki/9e19338baafa1d511ebd16ab0d68fb5e-500x500.jpg
Мастурбатор-полуторс Kokos Oknyeo,14 900р.,Нет,Нет,https://nestidno.ru/masturbator-polutors-kokos-oknyeo,https://nestidno.ru/image/cache/catalog/i/gp/hl/8f80fafe020f3136e6c9b7338f8ae298-500x500.jpg
МАСТУРБАТОР-ротик SATISFACTION HOT BABE 2101-02LOLA,2 490р.,Нет,Нет,https://nestidno.ru/masturbator-rotik-satisfaction-hot-babe-2101-02lola,https://nestidno.ru/image/cache/catalog/2101-02LOLA_4-500x500.jpg
Многоразовый мастурбатор Tenga Air-Tech Strong,2 490р.,Нет,Нет,https://nestidno.ru/mnogorazoviy-masturbator-tenga-air-tech-strong,https://nestidno.ru/image/cache/catalog/i/nl/ki/8fd94f3387b25d81fab7a13917523983-500x500.jpg
"СЕКС-КУКЛА JENNIFER, ШАТЕНКА, TOYFA DOLLS-X 160 см",2 990р.,Нет,Нет,https://nestidno.ru/seks-kukla-jennifer-shatenka-toyfa-dolls-x-160-sm,https://nestidno.ru/image/cache/catalog/117022_1-500x500.jpg
Вагина и анус с вибрацией Realistic Cyber Skin 30 х 20 х 8 см,8 900р.,Нет,Нет,https://nestidno.ru/vagina-i-anus-s-vibratsiey-realistic-cyber-skin-kiberkoga,https://nestidno.ru/image/cache/catalog/660021_466-500x500.jpg
Интеллектуальный автоматический мастурбатор The Handy,34 900р.,-14%,29 900р.,https://nestidno.ru/intellektualnyj-avtomaticheskij-masturbator-the-handy,https://nestidno.ru/image/cache/catalog/5989500000-500x500.jpg
Мастурбатор Fleshlight Ice Lady Crystal Masturbator,7 900р.,Нет,Нет,https://nestidno.ru/masturbator-fleshlight-ice-lady-crystal-masturbator,https://nestidno.ru/image/cache/catalog/i/dc/oo/606b9c3c996c4b659efc6fb3c6086912-500x500.jpg
Мастурбатор FLESHLIGHT SIGNATURE Lana Rhoades Destiny,8 590р.,Нет,Нет,https://nestidno.ru/masturbator-fleshlight-signature-lana-rhoades-destiny,https://nestidno.ru/image/cache/catalog/14964-500x500.jpeg
Мастурбатор Tenga Flip Zero Gravity Black,13 900р.,Нет,Нет,https://nestidno.ru/masturbator-tenga-flip-zero-gravity-black,https://nestidno.ru/image/cache/catalog/TFZ-005_-500x500.jpg
Мастурбатор TENGA PREMIUM Rolling Head CUP,1 490р.,Нет,Нет,https://nestidno.ru/masturbator-tenga-premium-rolling-head-cup,https://nestidno.ru/image/cache/catalog/i/lo/gn/bf902836fd4684e8ad069882183a9c5e-500x500.jpeg
Мастурбатор TENGA SPINNER Tetra,3 900р.,Нет,Нет,https://nestidno.ru/masturbator-tenga-spinner-tetra-spn-001,https://nestidno.ru/image/cache/catalog/i/fj/hk/f3d0cd0a948dfe87abc4a2b7cd5bf1c2-500x500.jpg
Мастурбатор-ротик Vacuum cup masturbator 55 BM-00900T58-2,1 990р.,Нет,Нет,https://nestidno.ru/masturbator-rotik-vacuum-cup-masturbator-55-bm-00900t58-2,https://nestidno.ru/image/cache/catalog/BM-00900T58-2-500x500.jpg
РЕАЛИСТИЧНАЯ СЕКС-КУКЛА ВАЛЕРИЯ С ВИБРАЦИЕЙ 155 см,6 900р.,-20%,5 500р.,https://nestidno.ru/realistichnaya-seks-kukla-valeriya-s-vibratsiej-rost-155-sm-art-ee-10250,https://nestidno.ru/image/cache/catalog/i/ne/gi/3d61aafbf5931492e2acf1f422c671f1-500x500.jpg
РЕАЛИСТИЧНАЯ СЕКС-КУКЛА ВЕРОНИКА С ВИБРАЦИЕЙ рост 150 см,6 500р.,Нет,Нет,https://nestidno.ru/realistichnaya-seks-kukla-veronika-s-vibratsiej-rost-150-sm-art-ee-10252,https://nestidno.ru/image/cache/catalog/i/cb/hc/0e90aefc67ea554c4771994d6c69bacb-500x500.jpg
Вагина и анус Realistic Cyber Skin 30 х 20 х 8 см,6 900р.,Нет,Нет,https://nestidno.ru/vagina-i-anus-realistic-cyber-skin-art650001,https://nestidno.ru/image/cache/catalog/i/gk/hb/69400f31cc3a34c895e800c963f9455c-500x500.jpg
ИНТЕРАКТИВНЫЙ МАСТУРБАТОР С ГОЛОСОВЫМ СОПРОВОЖДЕНИЕМ Dirty Talk Interactive Mini F*Ck Me Silly Masturbator,12 900р.,Нет,Нет,https://nestidno.ru/interaktivnyj-masturbator-s-golosovym-soprovogdeniem-dirty-talk-interactive-mini-f-ck-me-silly-masturbator,https://nestidno.ru/image/cache/catalog/5937700000-500x500.jpg
ИНТЕРАКТИВНЫЙ МАСТУРБАТОР С ГОЛОСОВЫМ СОПРОВОЖДЕНИЕМ PDX Male Dirty Talk Interactive Fuck My Cock,19 000р.,-32%,12 900р.,https://nestidno.ru/interaktivnyj-masturbator-anus-s-golosovym-soprovogdeniem-pdx-male-dirty-talk-interactive-fuck-my-cock,https://nestidno.ru/image/cache/catalog/PD3787-21_345-500x500.jpg
Мастурбатор TENGA Rolling Head Cup Strong TOC-203H,1 490р.,Нет,Нет,https://nestidno.ru/masturbator-tenga-rolling-head-cup-strong-toc-203h,https://nestidno.ru/image/cache/catalog/i/hm/el/61fa37d264bfd58ce07655a181f35908-500x500.jpeg
Мастурбатор/ограничитель проникновения HOMME ROYAL HENCHMAN WHITE 7011-02LOLA,990р.,Нет,Нет,https://nestidno.ru/masturbator-stopper-homme-royal-henchman-white-7011-02lola,https://nestidno.ru/image/cache/catalog/7011-02LOLA_2-500x500.jpg
"РЕАЛИСТИЧНАЯ СЕКС-КУКЛА АНГЕЛИНА рост 150 см, арт. EE-10278",5 900р.,Нет,Нет,https://nestidno.ru/realistichnaya-seks-kukla-angelina-rost-150-sm-art-ee-10278,https://nestidno.ru/image/cache/catalog/EE-10278-500x500.jpg
"РЕАЛИСТИЧНАЯ СЕКС-КУКЛА СИНДИ рост 150 см, арт. EE-10276",5 900р.,Нет,Нет,https://nestidno.ru/realistichnaya-seks-kukla-sindi-rost-150-sm-art-ee-10276,https://nestidno.ru/image/cache/catalog/EE-10276-500x500.jpg
Wand-мастурбатор для мужчин Rebel Man Wand 5997780000,8 490р.,Нет,Нет,https://nestidno.ru/wand-masturbator-dlya-mugchin-rebel-man-wand-5997780000,https://nestidno.ru/image/cache/catalog/5997780000-500x500.jpg
Вагина KOKOS THREE SISTERS Nymph 18 см,4 900р.,Нет,Нет,https://nestidno.ru/vagina-kokos-three-sisters-nymph-18-sm,https://nestidno.ru/image/cache/catalog/M03-001-03-500x500.jpg
Вагина и анус с вибрацией Realistic Cyber Skin 28 х 20 х 11 см,9 990р.,Нет,Нет,https://nestidno.ru/vagina-i-anus-s-vibratsiey-iz-kiberkogi-realistic-cyber-skin,https://nestidno.ru/image/cache/catalog/669421_111-500x500.jpg
Мастурбатор Tenga Aero Cobalt Ring,6 990р.,Нет,Нет,https://nestidno.ru/masturbator-tenga-aero-cobalt-ring,https://nestidno.ru/image/cache/catalog/tah-002-500x500.jpg
Мастурбатор Tenga Flip Zero White,13 900р.,Нет,Нет,https://nestidno.ru/masturbator-tenga-flip-zero-tfz-001,https://nestidno.ru/image/cache/catalog/TFZ-001-500x500.jpg
Мастурбатор анус и вагина 2 in 1 Hummer,4 490р.,Нет,Нет,https://nestidno.ru/masturbator-anus-i-vagina-2-in-1-hummer,https://nestidno.ru/image/cache/catalog/20588_3-500x500.jpg
Мастурбатор для мужчин Vacuum cup masturbator 55,1 990р.,Нет,Нет,https://nestidno.ru/masturbator-dlya-mugchin-vacuum-cup-masturbator-55,https://nestidno.ru/image/cache/catalog/BM-00900T58-1-500x500.jpg
Мастурбатор премиум-класса с регулировкой силы сжатия Arcwave Voy,6 990р.,Нет,Нет,https://nestidno.ru/masturbator-premium-klassa-s-regulirovkoj-sily-sgatiya-arcwave-voy,https://nestidno.ru/image/cache/catalog/voy_311-500x500.jpg
МАСТУРБАТОР с вибрацией PRETTY LOVE BM-009158,1 990р.,Нет,Нет,https://nestidno.ru/masturbator-pretty-love-bm-009158n,https://nestidno.ru/image/cache/catalog/BM-009158_44-500x500.jpg
Мастурбатор Fleshlight Girls Vina Sky Exotica Signature,9 900р.,-29%,6 990р.,https://nestidno.ru/masturbator-fleshlight-girls-vina-sky-exotica-signature,https://nestidno.ru/image/cache/catalog/11789-500x500.jpeg
Мастурбатор Tenga Flex Bubbly Blue,3 900р.,Нет,Нет,https://nestidno.ru/masturbator-tenga-flex-bubbly-blue,https://nestidno.ru/image/cache/catalog/FLX-003-500x500.jpg
Мастурбатор Tenga Flex Fizzy Green,3 900р.,Нет,Нет,https://nestidno.ru/masturbator-tenga-flex-fizzy-green,https://nestidno.ru/image/cache/catalog/FLX-004_55-500x500.jpg
Мастурбатор Tenga Flex Rocky Black,3 900р.,Нет,Нет,https://nestidno.ru/masturbator-tenga-flex-rocky-black-flx-002,https://nestidno.ru/image/cache/catalog/FLX-002_8-500x500.jpg
Мастурбатор Tenga Flip ORB Orange Crash,8 990р.,Нет,Нет,https://nestidno.ru/masturbator-tenga-flip-orb-orange-crash-tfo-002,https://nestidno.ru/image/cache/catalog/tfo-002_11-500x500.jpg
Мастурбатор для тренировки выносливости Fleshlight Quickshot Stamina Training,4 990р.,Нет,Нет,https://nestidno.ru/masturbator-dlya-trenirovki-vynoslivosti-fleshlight-quickshot-stamina-training,https://nestidno.ru/image/cache/catalog/10973-500x500.jpg
Мастурбатор с вибрацией Baile Joahn,2 490р.,Нет,Нет,https://nestidno.ru/masturbator-s-vibratsiey-baile-joahn-bm-009150,https://nestidno.ru/image/cache/catalog/bm-009150-500x500.jpg
Секс-машина Robo FUK Deluxe,29 900р.,-23%,22 900р.,https://nestidno.ru/seks-mashina-robo-fuk,https://nestidno.ru/image/cache/catalog/robofuk_46_6-500x500.jpg
