СЕКС-МАШИНА MOTORLOVERS PINK-PUNK,16 900р.,-18%,13 900р.,https://nestidno.ru/seks-mashina-pink-punk-motolovers,https://nestidno.ru/image/cache/catalog/i/dk/hh/c8882dfc842f51be43257085a34e837d-500x500.jpg
Фаллоимитатор с поступательными движениями и ротацией Erowoman ER-30074 15 см,6 500р.,Нет,Нет,https://nestidno.ru/vibrator-s-postupatelnymi-dvigeniyami-i-rotatsiej-erowoman-er-30074-15-sm,https://nestidno.ru/image/cache/catalog/ER-30074_-500x500.jpg
Интерактивный мастурбатор Kiiroo Keon & Feel Stroker,24 900р.,Нет,Нет,https://nestidno.ru/interaktivnyj-masturbator-keon-by-kiiroo,https://nestidno.ru/image/cache/catalog/11032-500x500.jpeg
Интеллектуальный автоматический мастурбатор The Handy,34 900р.,-14%,29 900р.,https://nestidno.ru/intellektualnyj-avtomaticheskij-masturbator-the-handy,https://nestidno.ru/image/cache/catalog/5989500000-500x500.jpg
Фаллоимитатор с поступательными движениями и ротацией Erowoman ER-30072 17 см,6 500р.,Нет,Нет,https://nestidno.ru/vibrator-s-postupatelnymi-dvigeniyami-i-rotatsiej-erowoman-er-30072-17-sm,https://nestidno.ru/image/cache/catalog/ER-30072_2-500x500.jpg
Секс-машина Machine Gun,14 900р.,-34%,9 900р.,https://nestidno.ru/seks-mashina-machina-gun,https://nestidno.ru/image/cache/catalog/machine-500x500.jpg
Секс-машина Robo FUK Deluxe,29 900р.,-23%,22 900р.,https://nestidno.ru/seks-mashina-robo-fuk,https://nestidno.ru/image/cache/catalog/robofuk_46_6-500x500.jpg
Универсальная секс-машина с пультом ДУ Pipedream International Couples Sex Machine,39 900р.,Нет,Нет,https://nestidno.ru/universalnaya-seks-mashina-s-pultom-du-pipedream-international-couples-sex-machine,https://nestidno.ru/image/cache/catalog/PD3763-19_-500x500.jpg
Полноразмерная секс-машина Дикая любовь,49 000р.,-29%,34 900р.,https://nestidno.ru/polnorazmernaya-seks-mashina-dikaya-lyubov,https://nestidno.ru/image/cache/catalog/wildlove_5-500x500.jpg
Адаптер для фаллоимитаторов-насадок для Kiiroo Keon Dildo Adapter,3 990р.,Нет,Нет,https://nestidno.ru/adapter-dlya-falloimitatorov-nasadok-dlya-kiiroo-keon-dildo-adapter,https://nestidno.ru/image/cache/catalog/11036-1-500x500.jpeg
Подушка с креплением для Kiiroo Keon Multifunctional Pillow & Strap,6 600р.,Нет,Нет,https://nestidno.ru/podushka-s-krepleniem-dlya-kiiroo-keon-multifunctional-pillow-strap,https://nestidno.ru/image/cache/catalog/20048_1-500x500.jpg
Секс-машина My Pleasure,59 000р.,-24%,44 900р.,https://nestidno.ru/seks-mashina-my-pleasure,https://nestidno.ru/image/cache/catalog/000024631-500x500.jpg
